"Quarter","Time","Quarter_Time","Team","Play","Home_Points","Away_Points","Game_Id"
2,13.7166666666667,10.2833333333333,"SA","Davis Bertans misses 31-foot three point pullup jump shot","9 "," 9","400974440"
2,13.7166666666667,10.2833333333333,"MIN","Jamal Crawford defensive rebound","9 "," 9","400974440"
2,13.8666666666667,10.1333333333333,"MIN","Nemanja Bjelica misses layup","9 "," 9","400974440"
2,13.8666666666667,10.1333333333333,"MIN","Karl-Anthony Towns offensive rebound","9 "," 9","400974440"
2,13.9166666666667,10.0833333333333,"MIN","Karl-Anthony Towns misses layup","9 "," 9","400974440"
2,13.9166666666667,10.0833333333333,"SA","Davis Bertans defensive rebound","9 "," 9","400974440"
2,14.0166666666667,9.98333333333333,"SA","Dejounte Murray lost ball turnover (Tyus Jones steals)","9 "," 9","400974440"
2,14.0666666666667,9.93333333333333,"MIN","Tyus Jones makes two point shot","9 "," 9","400974440"
2,14.0666666666667,9.93333333333333,"SA","Pau Gasol shooting foul","9 "," 9","400974440"
2,14.0666666666667,9.93333333333333,"SA","Kyle Anderson enters the game for Pau Gasol","9 "," 9","400974440"
2,14.0666666666667,9.93333333333333,"SA","LaMarcus Aldridge enters the game for Rudy Gay","9 "," 9","400974440"
2,14.0666666666667,9.93333333333333,"MIN","Jimmy Butler enters the game for Nemanja Bjelica","9 "," 9","400974440"
2,14.0666666666667,9.93333333333333,"MIN","Tyus Jones makes free throw 1 of 1","9 "," 9","400974440"
2,14.3333333333333,9.66666666666667,"SA","Danny Green misses 14-foot jumper","9 "," 9","400974440"
2,14.3333333333333,9.66666666666667,"MIN","Jimmy Butler defensive rebound","9 "," 9","400974440"
2,14.6,9.4,"MIN","Karl-Anthony Towns makes dunk (Tyus Jones assists)","9 "," 9","400974440"
2,14.9,9.1,"SA","LaMarcus Aldridge misses two point shot","9 "," 9","400974440"
2,14.9,9.1,"MIN","Jamal Crawford defensive rebound","9 "," 9","400974440"
2,14.9833333333333,9.01666666666667,"SA","Dejounte Murray shooting foul","9 "," 9","400974440"
2,14.9833333333333,9.01666666666667,"MIN","Jamal Crawford makes free throw 1 of 3","9 "," 9","400974440"
2,14.9833333333333,9.01666666666667,"MIN","Jamal Crawford makes free throw 2 of 3","9 "," 9","400974440"
2,14.9833333333333,9.01666666666667,"MIN","Jamal Crawford makes free throw 3 of 3","9 "," 9","400974440"
2,15.35,8.65,"SA","LaMarcus Aldridge makes 16-foot two point shot (Danny Green assists)","9 "," 9","400974440"
2,15.7,8.3,"MIN","Karl-Anthony Towns bad pass (Dejounte Murray steals)","9 "," 9","400974440"
2,15.7666666666667,8.23333333333333,"SA","Dejounte Murray makes dunk","9 "," 9","400974440"
2,16.0666666666667,7.93333333333333,"MIN","Shabazz Muhammad misses 6-foot jumper","9 "," 9","400974440"
2,16.0666666666667,7.93333333333333,"SA","LaMarcus Aldridge defensive rebound","9 "," 9","400974440"
2,16.1,7.9,"SA","Joffrey Lauvergne enters the game for Davis Bertans","9 "," 9","400974440"
2,16.2,7.8,"MIN","Karl-Anthony Towns vs. LaMarcus Aldridge (Tyus Jones gains possession)","9 "," 9","400974440"
2,16.2,7.8,"SA","LaMarcus Aldridge turnover Karl-Anthony Towns","9 "," 9","400974440"
2,16.2,7.8,"SA","Danny Green personal foul","9 "," 9","400974440"
2,16.2,7.8,"MIN","Karl-Anthony Towns makes free throw 1 of 2","9 "," 9","400974440"
2,16.2,7.8,"MIN","Karl-Anthony Towns makes free throw 2 of 2","9 "," 9","400974440"
2,16.4666666666667,7.53333333333333,"SA","LaMarcus Aldridge makes finger roll layup","9 "," 9","400974440"
2,16.7333333333333,7.26666666666667,"MIN","Karl-Anthony Towns makes dunk (Jimmy Butler assists)","9 "," 9","400974440"
2,17.1166666666667,6.88333333333333,"SA","Dejounte Murray makes jumper (LaMarcus Aldridge assists)","9 "," 9","400974440"
2,17.45,6.55,"MIN","Karl-Anthony Towns misses 4-foot two point shot","9 "," 9","400974440"
2,17.45,6.55,"SA","Kyle Anderson defensive rebound","9 "," 9","400974440"
2,17.5666666666667,6.43333333333333,"MIN","Tyus Jones personal foul","9 "," 9","400974440"
2,17.5666666666667,6.43333333333333,"SA","Spurs Full timeout","9 "," 9","400974440"
2,17.5666666666667,6.43333333333333,"MIN","Jeff Teague enters the game for Tyus Jones","9 "," 9","400974440"
2,17.5666666666667,6.43333333333333,"MIN","Gorgui Dieng enters the game for Jamal Crawford","9 "," 9","400974440"
2,17.5666666666667,6.43333333333333,"MIN","Taj Gibson enters the game for Karl-Anthony Towns","9 "," 9","400974440"
2,17.7333333333333,6.26666666666667,"SA","Joffrey Lauvergne misses hook shot","9 "," 9","400974440"
2,17.75,6.25,"MIN","Jeff Teague defensive rebound","9 "," 9","400974440"
2,18.0833333333333,5.91666666666667,"MIN","Taj Gibson misses 13-foot jumper","9 "," 9","400974440"
2,18.1,5.9,"SA","Kyle Anderson defensive rebound","9 "," 9","400974440"
2,18.2666666666667,5.73333333333333,"SA","Danny Green makes 17-foot step back jumpshot (LaMarcus Aldridge assists)","9 "," 9","400974440"
2,18.7166666666667,5.28333333333333,"MIN","Gorgui Dieng misses 16-foot pullup jump shot","9 "," 9","400974440"
2,18.7666666666667,5.23333333333333,"SA","Kyle Anderson defensive rebound","9 "," 9","400974440"
2,18.85,5.15,"MIN","Shabazz Muhammad shooting foul","9 "," 9","400974440"
2,18.85,5.15,"SA","Kyle Anderson misses free throw 1 of 2","9 "," 9","400974440"
2,18.85,5.15,"SA","Spurs offensive team rebound","9 "," 9","400974440"
2,18.85,5.15,"SA","Patty Mills enters the game for Dejounte Murray","9 "," 9","400974440"
2,18.85,5.15,"SA","Pau Gasol enters the game for Danny Green","9 "," 9","400974440"
2,18.85,5.15,"SA","Rudy Gay enters the game for Joffrey Lauvergne","9 "," 9","400974440"
2,18.85,5.15,"MIN","Andrew Wiggins enters the game for Shabazz Muhammad","9 "," 9","400974440"
2,18.85,5.15,"SA","Kyle Anderson makes free throw 2 of 2","9 "," 9","400974440"
2,19.05,4.95,"MIN","Andrew Wiggins misses 19-foot pullup jump shot","9 "," 9","400974440"
2,19.1166666666667,4.88333333333333,"SA","Patty Mills bad pass (Gorgui Dieng steals)","9 "," 9","400974440"
2,19.1333333333333,4.86666666666667,"SA","Patty Mills defensive rebound","9 "," 9","400974440"
2,19.45,4.55,"MIN","Gorgui Dieng misses 26-foot three point jumper","9 "," 9","400974440"
2,19.5,4.5,"SA","Rudy Gay defensive rebound","9 "," 9","400974440"
2,19.55,4.45,"SA","Jeff Teague blocks Kyle Anderson's layup","9 "," 9","400974440"
2,19.55,4.45,"MIN","Gorgui Dieng defensive rebound","9 "," 9","400974440"
2,19.65,4.35,"MIN","Jimmy Butler misses driving layup","9 "," 9","400974440"
2,19.65,4.35,"SA","LaMarcus Aldridge defensive rebound","9 "," 9","400974440"
2,19.85,4.15,"SA","Rudy Gay misses 27-foot three point pullup jump shot","9 "," 9","400974440"
2,19.85,4.15,"MIN","Jimmy Butler defensive rebound","9 "," 9","400974440"
2,20.05,3.95,"MIN","Taj Gibson misses 18-foot jumper","9 "," 9","400974440"
2,20.05,3.95,"SA","Pau Gasol defensive rebound","9 "," 9","400974440"
2,20.1666666666667,3.83333333333333,"SA","Spurs Full timeout","9 "," 9","400974440"
2,20.1666666666667,3.83333333333333,"SA","Manu Ginobili enters the game for Kyle Anderson","9 "," 9","400974440"
2,20.1666666666667,3.83333333333333,"MIN","Karl-Anthony Towns enters the game for Gorgui Dieng","9 "," 9","400974440"
2,20.25,3.75,"MIN","Jimmy Butler shooting foul","9 "," 9","400974440"
2,20.25,3.75,"SA","Manu Ginobili makes free throw 1 of 2","9 "," 9","400974440"
2,20.25,3.75,"SA","Manu Ginobili makes free throw 2 of 2","9 "," 9","400974440"
2,20.4333333333333,3.56666666666667,"MIN","Jimmy Butler misses 15-foot pullup jump shot","9 "," 9","400974440"
2,20.4833333333333,3.51666666666667,"SA","LaMarcus Aldridge defensive rebound","9 "," 9","400974440"
2,20.5833333333333,3.41666666666667,"MIN","Jeff Teague kicked ball violation","9 "," 9","400974440"
2,20.7166666666667,3.28333333333333,"SA","Pau Gasol makes jumper (Patty Mills assists)","9 "," 9","400974440"
2,20.9333333333333,3.06666666666667,"MIN","Karl-Anthony Towns makes 20-foot jumper (Jeff Teague assists)","9 "," 9","400974440"
2,21.1,2.9,"SA","Manu Ginobili misses 26-foot three point jumper","9 "," 9","400974440"
2,21.2166666666667,2.78333333333333,"SA","LaMarcus Aldridge offensive rebound","9 "," 9","400974440"
2,21.2166666666667,2.78333333333333,"SA","LaMarcus Aldridge makes dunk","9 "," 9","400974440"
2,21.5833333333333,2.41666666666667,"MIN","Taj Gibson misses layup","9 "," 9","400974440"
2,21.6166666666667,2.38333333333333,"SA","Manu Ginobili defensive rebound","9 "," 9","400974440"
2,21.6833333333333,2.31666666666667,"SA","Manu Ginobili bad pass (Jeff Teague steals)","9 "," 9","400974440"
2,21.7666666666667,2.23333333333333,"MIN","Taj Gibson makes dunk (Jeff Teague assists)","9 "," 9","400974440"
2,21.9666666666667,2.03333333333333,"SA","LaMarcus Aldridge misses 15-foot two point shot","9 "," 9","400974440"
2,21.9666666666667,2.03333333333333,"MIN","Andrew Wiggins defensive rebound","9 "," 9","400974440"
2,22.2333333333333,1.76666666666667,"MIN","Jeff Teague makes 25-foot three pointer (Taj Gibson assists)","9 "," 9","400974440"
2,22.5666666666667,1.43333333333333,"SA","Rudy Gay makes dunk (Manu Ginobili assists)","9 "," 9","400974440"
2,22.7166666666667,1.28333333333333,"SA","Patty Mills shooting foul","9 "," 9","400974440"
2,22.7166666666667,1.28333333333333,"MIN","Jeff Teague misses free throw 1 of 2","9 "," 9","400974440"
2,22.7166666666667,1.28333333333333,"MIN","Timberwolves offensive team rebound","9 "," 9","400974440"
2,22.7166666666667,1.28333333333333,"MIN","Jeff Teague makes free throw 2 of 2","9 "," 9","400974440"
2,23.05,0.95,"SA","Rudy Gay makes hook shot","9 "," 9","400974440"
2,23.2666666666667,0.733333333333333,"SA","Rudy Gay shooting foul","9 "," 9","400974440"
2,23.2666666666667,0.733333333333333,"MIN","Andrew Wiggins misses free throw 1 of 2","9 "," 9","400974440"
2,23.2666666666667,0.733333333333333,"MIN","Timberwolves offensive team rebound","9 "," 9","400974440"
2,23.2666666666667,0.733333333333333,"MIN","Andrew Wiggins makes free throw 2 of 2","9 "," 9","400974440"
2,23.45,0.55,"SA","LaMarcus Aldridge misses jumper","9 "," 9","400974440"
2,23.4833333333333,0.516666666666667,"MIN","Jeff Teague defensive rebound","9 "," 9","400974440"
2,23.8,0.2,"MIN","Andrew Wiggins makes 27-foot three point jumper (Jimmy Butler assists)","9 "," 9","400974440"
2,23.95,0.05,"SA","Manu Ginobili misses 25-foot three point pullup jump shot","9 "," 9","400974440"
2,23.9666666666667,0.0333333333333333,"SA","Pau Gasol offensive rebound","9 "," 9","400974440"
2,23.9666666666667,0.0333333333333333,"SA","Pau Gasol misses layup","9 "," 9","400974440"
2,23.9833333333333,0.0166666666666667,"SA","LaMarcus Aldridge offensive rebound","9 "," 9","400974440"
2,23.9833333333333,0.0166666666666667,"SA","LaMarcus Aldridge misses tip shot","9 "," 9","400974440"
2,24,0,"SA","Spurs offensive team rebound","9 "," 9","400974440"
2,24,0,"SA","End of the 2nd Quarter","9 "," 9","400974440"
3,24,12,"SA","Kyle Anderson enters the game for Patty Mills","9 "," 9","400974440"
3,24,12,"SA","Danny Green enters the game for Rudy Gay","9 "," 9","400974440"
3,24,12,"SA","Dejounte Murray enters the game for Manu Ginobili","9 "," 9","400974440"
3,24.3666666666666,11.6333333333333,"SA","Danny Green misses 24-foot three point pullup jump shot","9 "," 9","400974440"
3,24.4333333333333,11.5666666666667,"MIN","Karl-Anthony Towns defensive rebound","9 "," 9","400974440"
3,24.6833333333333,11.3166666666667,"MIN","Jimmy Butler makes alley oop dunk shot (Jeff Teague assists)","9 "," 9","400974440"
3,25,11,"SA","Kyle Anderson makes layup (Pau Gasol assists)","9 "," 9","400974440"
3,25.2833333333333,10.7166666666667,"SA","Dejounte Murray shooting foul","9 "," 9","400974440"
3,25.2833333333333,10.7166666666667,"MIN","Jeff Teague makes free throw 1 of 2","9 "," 9","400974440"
3,25.2833333333333,10.7166666666667,"MIN","Jeff Teague makes free throw 2 of 2","9 "," 9","400974440"
3,25.5666666666666,10.4333333333333,"SA","LaMarcus Aldridge makes driving layup","9 "," 9","400974440"
3,25.5666666666666,10.4333333333333,"MIN","Taj Gibson shooting foul","9 "," 9","400974440"
3,25.5666666666666,10.4333333333333,"SA","LaMarcus Aldridge makes free throw 1 of 1","9 "," 9","400974440"
3,25.8333333333333,10.1666666666667,"MIN","Andrew Wiggins misses driving floating jump shot","9 "," 9","400974440"
3,25.8833333333333,10.1166666666667,"SA","Dejounte Murray defensive rebound","9 "," 9","400974440"
3,25.9833333333333,10.0166666666667,"SA","Kyle Anderson misses 8-foot pullup jump shot","9 "," 9","400974440"
3,26.0333333333333,9.96666666666667,"MIN","Jimmy Butler defensive rebound","9 "," 9","400974440"
3,26.2166666666666,9.78333333333333,"MIN","Taj Gibson misses 23-foot three point jumper","9 "," 9","400974440"
3,26.2833333333333,9.71666666666667,"SA","Kyle Anderson defensive rebound","9 "," 9","400974440"
3,26.4166666666666,9.58333333333333,"SA","Dejounte Murray makes 2-foot layup (Pau Gasol assists)","9 "," 9","400974440"
3,26.65,9.35,"MIN","Jeff Teague lost ball turnover (Dejounte Murray steals)","9 "," 9","400974440"
3,26.6666666666666,9.33333333333333,"MIN","Jimmy Butler shooting foul","9 "," 9","400974440"
3,26.6666666666666,9.33333333333333,"SA","Dejounte Murray makes free throw 1 of 2","9 "," 9","400974440"
3,26.6666666666666,9.33333333333333,"SA","Dejounte Murray makes free throw 2 of 2","9 "," 9","400974440"
3,26.85,9.15,"MIN","Karl-Anthony Towns makes 10-foot two point shot (Jeff Teague assists)","9 "," 9","400974440"
3,27.1166666666666,8.88333333333333,"SA","Danny Green misses 25-foot three point pullup jump shot","9 "," 9","400974440"
3,27.1166666666666,8.88333333333333,"MIN","Karl-Anthony Towns defensive rebound","9 "," 9","400974440"
3,27.3666666666666,8.63333333333333,"MIN","Andrew Wiggins makes 27-foot three point jumper (Taj Gibson assists)","9 "," 9","400974440"
3,27.3833333333333,8.61666666666667,"SA","Spurs Full timeout","9 "," 9","400974440"
3,27.5833333333333,8.41666666666667,"SA","LaMarcus Aldridge misses 21-foot jumper","9 "," 9","400974440"
3,27.7,8.3,"MIN","Andrew Wiggins defensive rebound","9 "," 9","400974440"
3,27.9,8.1,"MIN","Jimmy Butler out of bounds bad pass turnover","9 "," 9","400974440"
3,28.1666666666667,7.83333333333333,"SA","Kyle Anderson misses jumper","9 "," 9","400974440"
3,28.25,7.75,"SA","Dejounte Murray offensive rebound","9 "," 9","400974440"
3,28.2833333333333,7.71666666666667,"SA","Dejounte Murray makes jump bank shot","9 "," 9","400974440"
3,28.5,7.5,"MIN","Andrew Wiggins makes 23-foot three point jumper","9 "," 9","400974440"
3,28.8333333333333,7.16666666666667,"SA","Danny Green makes 18-foot step back jumpshot (Pau Gasol assists)","9 "," 9","400974440"
3,29.2166666666667,6.78333333333333,"MIN","Karl-Anthony Towns makes 7-foot two point shot","9 "," 9","400974440"
3,29.35,6.65,"MIN","Taj Gibson shooting foul","9 "," 9","400974440"
3,29.35,6.65,"SA","LaMarcus Aldridge makes free throw 1 of 2","9 "," 9","400974440"
3,29.35,6.65,"SA","LaMarcus Aldridge makes free throw 2 of 2","9 "," 9","400974440"
3,29.7333333333333,6.26666666666667,"MIN","Andrew Wiggins misses 28-foot three point pullup jump shot","9 "," 9","400974440"
3,29.7833333333333,6.21666666666667,"SA","Danny Green defensive rebound","9 "," 9","400974440"
3,30.0333333333333,5.96666666666667,"SA","Dejounte Murray makes 3-foot two point shot","9 "," 9","400974440"
3,30.2833333333333,5.71666666666667,"MIN","Karl-Anthony Towns misses driving layup","9 "," 9","400974440"
3,30.4333333333333,5.56666666666667,"MIN","Taj Gibson offensive rebound","9 "," 9","400974440"
3,30.4333333333333,5.56666666666667,"MIN","Taj Gibson misses tip shot","9 "," 9","400974440"
3,30.45,5.55,"SA","Danny Green defensive rebound","9 "," 9","400974440"
3,30.45,5.55,"SA","Danny Green makes 25-foot three pointer","9 "," 9","400974440"
3,30.45,5.55,"MIN","Timberwolves Full timeout","9 "," 9","400974440"
3,30.45,5.55,"SA","Joffrey Lauvergne enters the game for Pau Gasol","9 "," 9","400974440"
3,30.45,5.55,"MIN","Gorgui Dieng enters the game for Karl-Anthony Towns","9 "," 9","400974440"
3,30.6666666666667,5.33333333333333,"MIN","Jeff Teague makes 7-foot driving floating jump shot","9 "," 9","400974440"
3,30.9666666666667,5.03333333333333,"SA","LaMarcus Aldridge makes 9-foot two point shot","9 "," 9","400974440"
3,31.3833333333333,4.61666666666667,"MIN","Jimmy Butler traveling","9 "," 9","400974440"
3,31.3833333333333,4.61666666666667,"SA","Manu Ginobili enters the game for Kyle Anderson","9 "," 9","400974440"
3,31.3833333333333,4.61666666666667,"SA","Rudy Gay enters the game for LaMarcus Aldridge","9 "," 9","400974440"
3,31.6166666666667,4.38333333333333,"MIN","Jeff Teague personal foul","9 "," 9","400974440"
3,31.6166666666667,4.38333333333333,"SA","Patty Mills enters the game for Dejounte Murray","9 "," 9","400974440"
3,31.7333333333333,4.26666666666667,"SA","Danny Green bad pass (Taj Gibson steals)","9 "," 9","400974440"
3,31.8166666666667,4.18333333333333,"MIN","Jeff Teague makes 8-foot driving floating jump shot","9 "," 9","400974440"
3,31.8166666666667,4.18333333333333,"SA","Patty Mills shooting foul","9 "," 9","400974440"
3,31.8166666666667,4.18333333333333,"MIN","Jamal Crawford enters the game for Jimmy Butler","9 "," 9","400974440"
3,31.8166666666667,4.18333333333333,"MIN","Jeff Teague makes free throw 1 of 1","9 "," 9","400974440"
3,32.0333333333333,3.96666666666667,"SA","Joffrey Lauvergne bad pass","9 "," 9","400974440"
3,32.25,3.75,"MIN","Jeff Teague misses 10-foot two point shot","9 "," 9","400974440"
3,32.3,3.7,"SA","Danny Green defensive rebound","9 "," 9","400974440"
3,32.4,3.6,"SA","Joffrey Lauvergne makes 7-foot jumper (Danny Green assists)","9 "," 9","400974440"
3,32.7333333333333,3.26666666666667,"MIN","Taj Gibson lost ball turnover (Rudy Gay steals)","9 "," 9","400974440"
3,32.8,3.2,"MIN","Jamal Crawford shooting foul","9 "," 9","400974440"
3,32.8,3.2,"SA","Rudy Gay makes free throw 1 of 2","9 "," 9","400974440"
3,32.8,3.2,"SA","Kyle Anderson enters the game for Danny Green","9 "," 9","400974440"
3,32.8,3.2,"MIN","Nemanja Bjelica enters the game for Jeff Teague","9 "," 9","400974440"
3,32.8,3.2,"MIN","Tyus Jones enters the game for Taj Gibson","9 "," 9","400974440"
3,32.8,3.2,"SA","Rudy Gay makes free throw 2 of 2","9 "," 9","400974440"
3,33,3,"MIN","Andrew Wiggins makes dunk (Gorgui Dieng assists)","9 "," 9","400974440"
3,33.2666666666667,2.73333333333333,"SA","Manu Ginobili misses 15-foot two point shot","9 "," 9","400974440"
3,33.2666666666667,2.73333333333333,"SA","Joffrey Lauvergne offensive rebound","9 "," 9","400974440"
3,33.35,2.65,"SA","Kyle Anderson makes finger roll layup (Joffrey Lauvergne assists)","9 "," 9","400974440"
3,33.7,2.3,"MIN","Andrew Wiggins makes 4-foot two point shot (Nemanja Bjelica assists)","9 "," 9","400974440"
3,33.9166666666667,2.08333333333333,"SA","Patty Mills misses 25-foot three point pullup jump shot","9 "," 9","400974440"
3,33.9166666666667,2.08333333333333,"MIN","Andrew Wiggins defensive rebound","9 "," 9","400974440"
3,34.1,1.9,"MIN","Andrew Wiggins makes 15-foot pullup jump shot","9 "," 9","400974440"
3,34.4666666666667,1.53333333333333,"SA","Rudy Gay misses pullup jump shot","9 "," 9","400974440"
3,34.4666666666667,1.53333333333333,"MIN","Nemanja Bjelica defensive rebound","9 "," 9","400974440"
3,34.6166666666667,1.38333333333333,"MIN","Gorgui Dieng lost ball turnover (Patty Mills steals)","9 "," 9","400974440"
3,34.8,1.2,"SA","Joffrey Lauvergne makes 2-foot hook shot (Kyle Anderson assists)","9 "," 9","400974440"
3,35.0166666666667,0.983333333333333,"MIN","Shabazz Muhammad enters the game for Andrew Wiggins","9 "," 9","400974440"
3,35.1666666666667,0.833333333333333,"MIN","Shabazz Muhammad misses 23-foot pullup jump shot","9 "," 9","400974440"
3,35.1666666666667,0.833333333333333,"SA","Patty Mills defensive rebound","9 "," 9","400974440"
3,35.2833333333333,0.716666666666667,"SA","Jamal Crawford blocks Manu Ginobili 's 7-foot layup","9 "," 9","400974440"
3,35.2833333333333,0.716666666666667,"SA","Spurs offensive team rebound","9 "," 9","400974440"
3,35.3,0.7,"SA","Manu Ginobili misses 25-foot three point jumper","9 "," 9","400974440"
3,35.3,0.7,"SA","Spurs offensive team rebound","9 "," 9","400974440"
3,35.45,0.55,"SA","Rudy Gay makes 11-foot pullup jump shot","9 "," 9","400974440"
3,35.65,0.35,"MIN","Jamal Crawford bad pass (Manu Ginobili steals)","9 "," 9","400974440"
3,35.6666666666667,0.333333333333333,"MIN","Gorgui Dieng personal foul","9 "," 9","400974440"
3,35.6666666666667,0.333333333333333,"SA","Manu Ginobili makes free throw 1 of 2","9 "," 9","400974440"
3,35.6666666666667,0.333333333333333,"SA","Manu Ginobili makes free throw 2 of 2","9 "," 9","400974440"
3,35.9,0.1,"SA","Rudy Gay personal foul","9 "," 9","400974440"
3,35.9833333333333,0.0166666666666667,"MIN","Nemanja Bjelica makes 26-foot three point jumper (Jamal Crawford assists)","9 "," 9","400974440"
3,36,0,"SA","End of the 3rd Quarter","9 "," 9","400974440"
4,36,12,"SA","LaMarcus Aldridge enters the game for Joffrey Lauvergne","9 "," 9","400974440"
4,36,12,"MIN","Karl-Anthony Towns enters the game for Gorgui Dieng","9 "," 9","400974440"
4,36.35,11.65,"MIN","Shabazz Muhammad misses 25-foot three point jumper","9 "," 9","400974440"
4,36.4166666666667,11.5833333333333,"SA","LaMarcus Aldridge defensive rebound","9 "," 9","400974440"
4,36.5666666666667,11.4333333333333,"SA","Rudy Gay misses 15-foot jumper","9 "," 9","400974440"
4,36.6166666666667,11.3833333333333,"MIN","Karl-Anthony Towns defensive rebound","9 "," 9","400974440"
4,36.95,11.05,"MIN","Nemanja Bjelica makes layup (Jamal Crawford assists)","9 "," 9","400974440"
4,36.95,11.05,"SA","LaMarcus Aldridge shooting foul","9 "," 9","400974440"
4,36.95,11.05,"SA","Danny Green enters the game for Kyle Anderson","9 "," 9","400974440"
4,36.95,11.05,"MIN","Nemanja Bjelica makes free throw 1 of 1","9 "," 9","400974440"
4,37.2333333333333,10.7666666666667,"SA","Shabazz Muhammad blocks Danny Green 's 3-foot two point shot","9 "," 9","400974440"
4,37.2333333333333,10.7666666666667,"SA","Spurs offensive team rebound","9 "," 9","400974440"
4,37.3,10.7,"SA","Danny Green misses 26-foot three point jumper","9 "," 9","400974440"
4,37.3,10.7,"SA","LaMarcus Aldridge offensive rebound","9 "," 9","400974440"
4,37.5666666666667,10.4333333333333,"SA","LaMarcus Aldridge misses 10-foot step back jumpshot","9 "," 9","400974440"
4,37.5666666666667,10.4333333333333,"MIN","Nemanja Bjelica defensive rebound","9 "," 9","400974440"
4,37.75,10.25,"MIN","Jamal Crawford makes 14-foot pullup jump shot","9 "," 9","400974440"
4,37.75,10.25,"SA","Patty Mills shooting foul","9 "," 9","400974440"
4,37.75,10.25,"MIN","Jamal Crawford makes free throw 1 of 1","9 "," 9","400974440"
4,37.9333333333333,10.0666666666667,"SA","Danny Green traveling","9 "," 9","400974440"
4,38.1,9.9,"MIN","Karl-Anthony Towns traveling","9 "," 9","400974440"
4,38.1,9.9,"SA","Kyle Anderson enters the game for Patty Mills","9 "," 9","400974440"
4,38.1,9.9,"SA","Pau Gasol enters the game for Manu Ginobili","9 "," 9","400974440"
4,38.1,9.9,"SA","Dejounte Murray enters the game for Rudy Gay","9 "," 9","400974440"
4,38.4333333333333,9.56666666666667,"SA","LaMarcus Aldridge misses 20-foot jumper","9 "," 9","400974440"
4,38.4833333333333,9.51666666666667,"MIN","Tyus Jones defensive rebound","9 "," 9","400974440"
4,38.5333333333333,9.46666666666667,"MIN","LaMarcus Aldridge blocks Karl-Anthony Towns 's 3-foot two point shot","9 "," 9","400974440"
4,38.7,9.3,"MIN","Shabazz Muhammad offensive rebound","9 "," 9","400974440"
4,38.7,9.3,"MIN","Shabazz Muhammad makes two point shot","9 "," 9","400974440"
4,38.95,9.05,"SA","Danny Green misses 16-foot pullup jump shot","9 "," 9","400974440"
4,39.0833333333333,8.91666666666667,"SA","Dejounte Murray offensive rebound","9 "," 9","400974440"
4,39.0833333333333,8.91666666666667,"SA","Dejounte Murray misses tip shot","9 "," 9","400974440"
4,39.1,8.9,"MIN","Karl-Anthony Towns defensive rebound","9 "," 9","400974440"
4,39.1333333333333,8.86666666666667,"MIN","Jamal Crawford misses 25-foot three point pullup jump shot","9 "," 9","400974440"
4,39.1666666666666,8.83333333333333,"SA","Pau Gasol defensive rebound","9 "," 9","400974440"
4,39.3166666666666,8.68333333333333,"SA","Kyle Anderson makes 7-foot two point shot (Dejounte Murray assists)","9 "," 9","400974440"
4,39.5666666666666,8.43333333333333,"MIN","Tyus Jones misses 17-foot pullup jump shot","9 "," 9","400974440"
4,39.5666666666666,8.43333333333333,"SA","Kyle Anderson defensive rebound","9 "," 9","400974440"
4,39.7,8.3,"SA","Danny Green misses 25-foot three point pullup jump shot","9 "," 9","400974440"
4,39.7,8.3,"MIN","Karl-Anthony Towns defensive rebound","9 "," 9","400974440"
4,39.9833333333333,8.01666666666667,"MIN","Nemanja Bjelica makes driving layup (Jamal Crawford assists)","9 "," 9","400974440"
4,39.9833333333333,8.01666666666667,"SA","Dejounte Murray shooting foul","9 "," 9","400974440"
4,39.9833333333333,8.01666666666667,"MIN","Jimmy Butler enters the game for Shabazz Muhammad","9 "," 9","400974440"
4,39.9833333333333,8.01666666666667,"SA","Spurs Full timeout","9 "," 9","400974440"
4,39.9833333333333,8.01666666666667,"MIN","Nemanja Bjelica makes free throw 1 of 1","9 "," 9","400974440"
4,40.3333333333333,7.66666666666667,"SA","LaMarcus Aldridge misses 12-foot jump bank shot","9 "," 9","400974440"
4,40.4,7.6,"MIN","Tyus Jones defensive rebound","9 "," 9","400974440"
4,40.6,7.4,"MIN","Nemanja Bjelica misses 25-foot three point jumper","9 "," 9","400974440"
4,40.6166666666666,7.38333333333333,"SA","Kyle Anderson defensive rebound","9 "," 9","400974440"
4,40.6166666666666,7.38333333333333,"MIN","Karl-Anthony Towns loose ball foul","9 "," 9","400974440"
4,40.9,7.1,"SA","Pau Gasol misses 5-foot two point shot","9 "," 9","400974440"
4,40.95,7.05,"MIN","Karl-Anthony Towns defensive rebound","9 "," 9","400974440"
4,41.1833333333333,6.81666666666667,"MIN","Pau Gasol blocks Jimmy Butler 's 2-foot driving layup","9 "," 9","400974440"
4,41.3333333333333,6.66666666666667,"MIN","Nemanja Bjelica offensive rebound","9 "," 9","400974440"
