"Quarter","Time","Quarter_Time","Team","Play","Home_Points","Away_Points","Game_Id"
4,45.1999999999999,2.8,"OKC","Dakari Johnson enters the game for Steven Adams","80 "," 98","400974441"
4,45.1999999999999,2.8,"NY","Frank Ntilikina enters the game for Tim Hardaway Jr.","80 "," 98","400974441"
4,45.1999999999999,2.8,"NY","Damyean Dotson enters the game for Kristaps Porzingis","80 "," 98","400974441"
4,45.2166666666666,2.78333333333333,"OKC","Terrance Ferguson misses dunk","80 "," 98","400974441"
4,45.2166666666666,2.78333333333333,"OKC","Jerami Grant offensive rebound","80 "," 98","400974441"
4,45.4166666666666,2.58333333333333,"OKC","Willy Hernangomez blocks Jerami Grant 's 3-foot pullup jump shot","80 "," 98","400974441"
4,45.4333333333332,2.56666666666667,"OKC","Thunder offensive team rebound","80 "," 98","400974441"
4,45.4333333333332,2.56666666666667,"OKC","Josh Huestis enters the game for Jerami Grant","80 "," 98","400974441"
4,45.4666666666666,2.53333333333333,"NY","Frank Ntilikina personal foul","80 "," 98","400974441"
4,45.6333333333332,2.36666666666667,"OKC","Dakari Johnson makes layup (Raymond Felton assists)","80 "," 98","400974441"
4,45.7499999999999,2.25,"NY","Willy Hernangomez makes driving layup (Ron Baker assists)","82 "," 98","400974441"
4,45.7499999999999,2.25,"OKC","Alex Abrines shooting foul","82 "," 98","400974441"
4,45.7499999999999,2.25,"NY","Willy Hernangomez makes free throw 1 of 1","83 "," 98","400974441"
4,45.9666666666666,2.03333333333333,"OKC","Alex Abrines misses 26-foot three point jumper","83 "," 98","400974441"
4,45.9666666666666,2.03333333333333,"NY","Ron Baker defensive rebound","83 "," 98","400974441"
4,46.2166666666666,1.78333333333333,"NY","Ron Baker bad pass (Dakari Johnson steals)","83 "," 98","400974441"
4,46.2833333333332,1.71666666666667,"OKC","Josh Huestis traveling","83 "," 98","400974441"
4,46.4666666666666,1.53333333333333,"NY","Damyean Dotson misses 20-foot jumper","83 "," 98","400974441"
4,46.4999999999999,1.5,"OKC","Dakari Johnson defensive rebound","83 "," 98","400974441"
4,46.6666666666666,1.33333333333333,"OKC","Dakari Johnson misses 1-foot hook shot","83 "," 98","400974441"
4,46.6666666666666,1.33333333333333,"OKC","Dakari Johnson offensive rebound","83 "," 98","400974441"
4,46.7333333333332,1.26666666666667,"OKC","Alex Abrines traveling","83 "," 98","400974441"
4,46.9333333333332,1.06666666666667,"NY","Willy Hernangomez lost ball turnover (Raymond Felton steals)","83 "," 98","400974441"
4,47.0666666666666,0.933333333333333,"OKC","Terrance Ferguson misses 9-foot two point shot","83 "," 98","400974441"
4,47.1166666666666,0.883333333333333,"OKC","Dakari Johnson offensive rebound","83 "," 98","400974441"
4,47.1166666666666,0.883333333333333,"OKC","Dakari Johnson makes two point shot","83 "," 98","400974441"
4,47.3333333333332,0.666666666666667,"OKC","Alex Abrines personal foul","83 "," 98","400974441"
4,47.3333333333332,0.666666666666667,"NY","Ron Baker makes free throw 1 of 2","84 "," 98","400974441"
4,47.3333333333332,0.666666666666667,"NY","Ron Baker misses free throw 2 of 2","84 "," 98","400974441"
4,47.3333333333332,0.666666666666667,"NY","Willy Hernangomez turnover (lane violation)","84 "," 98","400974441"
4,47.6166666666666,0.383333333333333,"OKC","Terrance Ferguson misses 25-foot three point jumper","84 "," 98","400974441"
4,47.6666666666666,0.333333333333333,"OKC","Dakari Johnson offensive rebound","84 "," 98","400974441"
4,47.6999999999999,0.3,"OKC","Alex Abrines misses 23-foot three point jumper","84 "," 98","400974441"
4,47.6999999999999,0.3,"OKC","Josh Huestis offensive rebound","84 "," 98","400974441"
4,47.9999999999999,0,"OKC","End of the 4th Quarter","84 "," 98","400974441"
4,47.9999999999999,0,"OKC","End of Game","84 "," 98","400974441"
1,0,12,"LAC","DeAndre Jordan vs. Brook Lopez (Blake Griffin gains possession)","0 "," 0","400974442"
1,0.333333333333334,11.6666666666667,"LAC","Danilo Gallinari misses finger roll layup","0 "," 0","400974442"
1,0.383333333333333,11.6166666666667,"LAL","Brandon Ingram defensive rebound","0 "," 0","400974442"
1,0.699999999999999,11.3,"LAL","Larry Nance Jr. misses 15-foot two point shot","0 "," 0","400974442"
1,0.75,11.25,"LAC","DeAndre Jordan defensive rebound","0 "," 0","400974442"
1,0.85,11.15,"LAC","Blake Griffin misses 26-foot three point jumper","0 "," 0","400974442"
1,0.883333333333333,11.1166666666667,"LAL","Brandon Ingram defensive rebound","0 "," 0","400974442"
1,1,11,"LAL","Brook Lopez misses 10-foot hook shot","0 "," 0","400974442"
1,1.16666666666667,10.8333333333333,"LAL","Larry Nance Jr. offensive rebound","0 "," 0","400974442"
1,1.16666666666667,10.8333333333333,"LAL","Larry Nance Jr. misses tip shot","0 "," 0","400974442"
1,1.18333333333333,10.8166666666667,"LAC","DeAndre Jordan defensive rebound","0 "," 0","400974442"
1,1.21666666666667,10.7833333333333,"LAC","Patrick Beverley misses 15-foot jumper","0 "," 0","400974442"
1,1.26666666666667,10.7333333333333,"LAL","Lonzo Ball defensive rebound","0 "," 0","400974442"
1,1.35,10.65,"LAL","Brandon Ingram misses 10-foot two point shot","0 "," 0","400974442"
1,1.35,10.65,"LAC","Danilo Gallinari defensive rebound","0 "," 0","400974442"
1,1.53333333333333,10.4666666666667,"LAC","Danilo Gallinari misses driving layup","0 "," 0","400974442"
1,1.55,10.45,"LAC","DeAndre Jordan offensive rebound","0 "," 0","400974442"
1,1.55,10.45,"LAC","DeAndre Jordan misses tip shot","0 "," 0","400974442"
1,1.55,10.45,"LAC","DeAndre Jordan offensive rebound","0 "," 0","400974442"
1,1.55,10.45,"LAL","Lonzo Ball shooting foul","0 "," 0","400974442"
1,1.55,10.45,"LAC","DeAndre Jordan makes free throw 1 of 2","1 "," 0","400974442"
1,1.55,10.45,"LAC","DeAndre Jordan makes free throw 2 of 2","2 "," 0","400974442"
1,1.75,10.25,"LAL","Brook Lopez misses 15-foot jumper","2 "," 0","400974442"
1,1.88333333333333,10.1166666666667,"LAL","Larry Nance Jr. offensive rebound","2 "," 0","400974442"
1,1.88333333333333,10.1166666666667,"LAL","Larry Nance Jr. makes dunk","2 "," 2","400974442"
1,1.95,10.05,"LAC","Milos Teodosic bad pass (Luol Deng steals)","2 "," 2","400974442"
1,2,10,"LAL","Luol Deng misses layup","2 "," 2","400974442"
1,2.06666666666667,9.93333333333333,"LAC","Milos Teodosic defensive rebound","2 "," 2","400974442"
1,2.3,9.7,"LAC","Blake Griffin makes layup","4 "," 2","400974442"
1,2.53333333333333,9.46666666666667,"LAL","Brandon Ingram lost ball turnover (DeAndre Jordan steals)","4 "," 2","400974442"
1,2.7,9.3,"LAC","Blake Griffin makes driving dunk","6 "," 2","400974442"
1,2.78333333333333,9.21666666666667,"LAC","Milos Teodosic shooting foul","6 "," 2","400974442"
1,2.78333333333333,9.21666666666667,"LAL","Brandon Ingram makes free throw 1 of 1","6 "," 3","400974442"
1,2.78333333333333,9.21666666666667,"LAL","Brandon Ingram makes free throw 2 of 2","6 "," 4","400974442"
1,3,9,"LAC","Patrick Beverley misses layup","6 "," 4","400974442"
1,3.03333333333333,8.96666666666667,"LAL","Larry Nance Jr. defensive rebound","6 "," 4","400974442"
1,3.05,8.95,"LAL","Luol Deng traveling","6 "," 4","400974442"
1,3.3,8.7,"LAC","Blake Griffin traveling","6 "," 4","400974442"
1,3.68333333333333,8.31666666666667,"LAL","Brandon Ingram misses layup","6 "," 4","400974442"
1,3.73333333333333,8.26666666666667,"LAC","DeAndre Jordan defensive rebound","6 "," 4","400974442"
1,3.78333333333333,8.21666666666667,"LAC","Danilo Gallinari makes 18-foot pullup jump shot","8 "," 4","400974442"
1,4.08333333333333,7.91666666666667,"LAL","Lonzo Ball misses driving floating jump shot","8 "," 4","400974442"
1,4.11666666666667,7.88333333333333,"LAC","DeAndre Jordan defensive rebound","8 "," 4","400974442"
1,4.15,7.85,"LAC","Milos Teodosic makes 25-foot three point jumper (Danilo Gallinari assists)","8 "," 4","400974442"
1,4.16666666666667,7.83333333333333,"LAL","Lakers Full timeout","8 "," 4","400974442"
1,4.26666666666667,7.73333333333333,"LAC","Patrick Beverley personal foul","8 "," 4","400974442"
1,4.26666666666667,7.73333333333333,"LAL","back court turnover","8 "," 4","400974442"
1,4.61666666666667,7.38333333333333,"LAC","Patrick Beverley misses 5-foot jumper","8 "," 4","400974442"
1,4.76666666666667,7.23333333333333,"LAC","DeAndre Jordan offensive rebound","8 "," 4","400974442"
1,4.76666666666667,7.23333333333333,"LAC","DeAndre Jordan misses tip shot","8 "," 4","400974442"
1,4.76666666666667,7.23333333333333,"LAL","Brook Lopez defensive rebound","8 "," 4","400974442"
1,4.8,7.2,"LAL","Brook Lopez misses 28-foot three point jumper","8 "," 4","400974442"
1,4.8,7.2,"LAC","Blake Griffin defensive rebound","8 "," 4","400974442"
1,5,7,"LAC","Blake Griffin makes layup (Milos Teodosic assists)","8 "," 4","400974442"
1,5.16666666666667,6.83333333333333,"LAC","DeAndre Jordan shooting foul","8 "," 4","400974442"
1,5.16666666666667,6.83333333333333,"LAL","Lonzo Ball misses free throw 1 of 2","8 "," 4","400974442"
1,5.16666666666667,6.83333333333333,"LAL","Lakers offensive team rebound","8 "," 4","400974442"
1,5.16666666666667,6.83333333333333,"LAC","Austin Rivers enters the game for Patrick Beverley","8 "," 4","400974442"
1,5.16666666666667,6.83333333333333,"LAL","Lonzo Ball misses free throw 2 of 2","8 "," 4","400974442"
1,5.2,6.8,"LAC","DeAndre Jordan defensive rebound","8 "," 4","400974442"
1,5.33333333333333,6.66666666666667,"LAC","Blake Griffin misses 22-foot step back jumpshot","8 "," 4","400974442"
1,5.38333333333333,6.61666666666667,"LAL","Lonzo Ball defensive rebound","8 "," 4","400974442"
1,5.38333333333333,6.61666666666667,"LAC","Blake Griffin clear path foul","8 "," 4","400974442"
1,5.38333333333333,6.61666666666667,"LAL","Brook Lopez makes free throw 1 of 2","8 "," 5","400974442"
1,5.38333333333333,6.61666666666667,"LAL","Brook Lopez makes free throw 2 of 2","8 "," 6","400974442"
1,5.55,6.45,"LAL","Brandon Ingram misses 17-foot jumper","8 "," 6","400974442"
1,5.6,6.4,"LAC","Danilo Gallinari defensive rebound","8 "," 6","400974442"
1,5.88333333333333,6.11666666666667,"LAC","Milos Teodosic misses 31-foot three point jumper","8 "," 6","400974442"
1,5.93333333333333,6.06666666666667,"LAL","Larry Nance Jr. defensive rebound","8 "," 6","400974442"
1,6.11666666666667,5.88333333333333,"LAL","Brook Lopez makes 24-foot three point jumper (Brandon Ingram assists)","8 "," 9","400974442"
1,6.35,5.65,"LAC","Lonzo Ball blocks Blake Griffin 's 12-foot jumper","8 "," 9","400974442"
1,6.36666666666667,5.63333333333333,"LAC","Clippers offensive team rebound","8 "," 9","400974442"
1,6.36666666666667,5.63333333333333,"LAL","Jordan Clarkson enters the game for Luol Deng","8 "," 9","400974442"
1,6.46666666666667,5.53333333333333,"LAC","Austin Rivers misses driving floating jump shot","8 "," 9","400974442"
1,6.53333333333333,5.46666666666667,"LAL","Lonzo Ball defensive rebound","8 "," 9","400974442"
1,6.63333333333333,5.36666666666667,"LAL","Brook Lopez misses 27-foot three point jumper","8 "," 9","400974442"
1,6.66666666666667,5.33333333333333,"LAC","DeAndre Jordan defensive rebound","8 "," 9","400974442"
1,6.85,5.15,"LAL","Brook Lopez shooting foul","8 "," 9","400974442"
1,6.85,5.15,"LAC","Danilo Gallinari makes free throw 1 of 2","8 "," 9","400974442"
1,6.85,5.15,"LAC","Danilo Gallinari makes free throw 2 of 2","8 "," 9","400974442"
1,7.05,4.95,"LAL","Jordan Clarkson makes 17-foot pullup jump shot","8 "," 9","400974442"
1,7.26666666666667,4.73333333333333,"LAC","Austin Rivers misses 26-foot three point jumper","8 "," 9","400974442"
1,7.3,4.7,"LAL","Larry Nance Jr. defensive rebound","8 "," 9","400974442"
1,7.45,4.55,"LAL","Milos Teodosic blocks Jordan Clarkson 's 4-foot jumper","8 "," 9","400974442"
1,7.45,4.55,"LAL","Lakers offensive team rebound","8 "," 9","400974442"
1,7.45,4.55,"LAL","Andrew Bogut enters the game for Brook Lopez","8 "," 9","400974442"
1,7.45,4.55,"LAC","Lou Williams enters the game for Milos Teodosic","8 "," 9","400974442"
1,7.45,4.55,"LAC","Willie Reed enters the game for DeAndre Jordan","8 "," 9","400974442"
1,7.55,4.45,"LAL","Lonzo Ball misses 25-foot three point jumper","8 "," 9","400974442"
1,7.61666666666667,4.38333333333333,"LAC","Willie Reed defensive rebound","8 "," 9","400974442"
1,7.91666666666667,4.08333333333333,"LAC","Blake Griffin misses 21-foot jumper","8 "," 9","400974442"
1,7.96666666666667,4.03333333333333,"LAL","Andrew Bogut defensive rebound","8 "," 9","400974442"
1,8.11666666666667,3.88333333333333,"LAL","Jordan Clarkson misses 7-foot hook shot","8 "," 9","400974442"
1,8.15,3.85,"LAC","Blake Griffin defensive rebound","8 "," 9","400974442"
1,8.23333333333333,3.76666666666667,"LAC","Blake Griffin lost ball turnover (Jordan Clarkson steals)","8 "," 9","400974442"
1,8.3,3.7,"LAL","Larry Nance Jr. makes 2-foot dunk (Jordan Clarkson assists)","8 "," 9","400974442"
1,8.51666666666667,3.48333333333333,"LAC","Lou Williams misses 19-foot pullup jump shot","8 "," 9","400974442"
1,8.56666666666667,3.43333333333333,"LAL","Lonzo Ball defensive rebound","8 "," 9","400974442"
1,8.71666666666667,3.28333333333333,"LAL","Larry Nance Jr. makes layup (Jordan Clarkson assists)","8 "," 9","400974442"
1,8.71666666666667,3.28333333333333,"LAC","Clippers Full timeout","8 "," 9","400974442"
1,8.71666666666667,3.28333333333333,"LAL","Kyle Kuzma enters the game for Larry Nance Jr.","8 "," 9","400974442"
1,8.71666666666667,3.28333333333333,"LAL","Julius Randle enters the game for Brandon Ingram","8 "," 9","400974442"
1,8.86666666666667,3.13333333333333,"LAC","Andrew Bogut blocks Willie Reed 's 4-foot jumper","8 "," 9","400974442"
1,8.88333333333333,3.11666666666667,"LAL","Jordan Clarkson defensive rebound","8 "," 9","400974442"
1,8.95,3.05,"LAL","Danilo Gallinari blocks Jordan Clarkson's dunk","8 "," 9","400974442"
1,8.96666666666667,3.03333333333333,"LAL","Julius Randle offensive rebound","8 "," 9","400974442"
1,8.96666666666667,3.03333333333333,"LAL","Julius Randle makes 2-foot dunk","8 "," 9","400974442"
1,9.08333333333333,2.91666666666667,"LAC","Lou Williams makes 24-foot three point jumper","8 "," 9","400974442"
1,9.35,2.65,"LAL","Andrew Bogut lost ball turnover (Blake Griffin steals)","8 "," 9","400974442"
1,9.45,2.55,"LAL","Andrew Bogut personal foul","8 "," 9","400974442"
1,9.45,2.55,"LAC","Wesley Johnson enters the game for Danilo Gallinari","8 "," 9","400974442"
1,9.66666666666666,2.33333333333333,"LAC","Austin Rivers misses layup","8 "," 9","400974442"
1,9.68333333333333,2.31666666666667,"LAC","Blake Griffin offensive rebound","8 "," 9","400974442"
1,9.8,2.2,"LAC","Willie Reed misses 7-foot two point shot","8 "," 9","400974442"
1,9.83333333333333,2.16666666666667,"LAL","Lonzo Ball defensive rebound","8 "," 9","400974442"
1,9.9,2.1,"LAL","Lonzo Ball misses layup","8 "," 9","400974442"
1,9.91666666666666,2.08333333333333,"LAC","Wesley Johnson defensive rebound","8 "," 9","400974442"
1,9.98333333333333,2.01666666666667,"LAL","Andrew Bogut shooting foul","8 "," 9","400974442"
1,9.98333333333333,2.01666666666667,"LAC","Blake Griffin makes free throw 1 of 2","8 "," 9","400974442"
1,9.98333333333333,2.01666666666667,"LAL","Alex Caruso enters the game for Lonzo Ball","8 "," 9","400974442"
1,9.98333333333333,2.01666666666667,"LAC","Blake Griffin makes free throw 2 of 2","8 "," 9","400974442"
1,10.2833333333333,1.71666666666667,"LAL","Jordan Clarkson misses 21-foot pullup jump shot","8 "," 9","400974442"
1,10.4,1.6,"LAC","Blake Griffin defensive rebound","8 "," 9","400974442"
1,10.4166666666667,1.58333333333333,"LAC","Blake Griffin makes driving dunk","8 "," 9","400974442"
1,10.6,1.4,"LAL","Julius Randle misses 22-foot jumper","8 "," 9","400974442"
1,10.6666666666667,1.33333333333333,"LAL","Julius Randle offensive rebound","8 "," 9","400974442"
1,10.75,1.25,"LAL","Kyle Kuzma misses 19-foot jumper","8 "," 9","400974442"
1,10.8333333333333,1.16666666666667,"LAC","Willie Reed defensive rebound","8 "," 9","400974442"
1,11.05,0.95,"LAC","Blake Griffin makes 26-foot three point jumper","8 "," 9","400974442"
1,11.1833333333333,0.816666666666667,"LAL","Jordan Clarkson makes 17-foot pullup jump shot (Andrew Bogut assists)","8 "," 9","400974442"
1,11.3166666666667,0.683333333333333,"LAC","Willie Reed bad pass (Andrew Bogut steals)","8 "," 9","400974442"
1,11.3333333333333,0.666666666666667,"LAL","Andrew Bogut bad pass (Lou Williams steals)","8 "," 9","400974442"
1,11.35,0.65,"LAC","Lou Williams bad pass (Kyle Kuzma steals)","8 "," 9","400974442"
1,11.4,0.6,"LAC","Willie Reed lost ball turnover (Andrew Bogut steals)","8 "," 9","400974442"
1,11.4333333333333,0.566666666666667,"LAL","Jordan Clarkson bad pass (Austin Rivers steals)","8 "," 9","400974442"
1,11.6333333333333,0.366666666666667,"LAC","Willie Reed makes 3-foot alley oop dunk shot (Lou Williams assists)","8 "," 9","400974442"
1,11.9666666666667,0.0333333333333333,"LAL","Jordan Clarkson out of bounds bad pass turnover","8 "," 9","400974442"
1,11.9666666666667,0.0333333333333333,"LAL","Corey Brewer enters the game for Julius Randle","8 "," 9","400974442"
1,12,0,"LAL","End of the 1st Quarter","8 "," 9","400974442"
2,12,12,"LAC","Danilo Gallinari enters the game for Blake Griffin","8 "," 9","400974442"
2,12.35,11.65,"LAL","Jordan Clarkson makes driving layup","8 "," 9","400974442"
2,12.6166666666667,11.3833333333333,"LAC","Austin Rivers misses driving floating jump shot","8 "," 9","400974442"
2,12.6166666666667,11.3833333333333,"LAC","Clippers offensive team rebound","8 "," 9","400974442"
2,12.7166666666667,11.2833333333333,"LAC","Lou Williams misses 23-foot three point jumper","8 "," 9","400974442"
2,12.7666666666667,11.2333333333333,"LAL","Andrew Bogut defensive rebound","8 "," 9","400974442"
2,12.8333333333333,11.1666666666667,"LAL","Kyle Kuzma misses 26-foot three point jumper","8 "," 9","400974442"
2,12.8833333333333,11.1166666666667,"LAC","Wesley Johnson defensive rebound","8 "," 9","400974442"
2,13.0166666666667,10.9833333333333,"LAL","Kyle Kuzma shooting foul","8 "," 9","400974442"
2,13.0166666666667,10.9833333333333,"LAC","Danilo Gallinari misses free throw 1 of 2","8 "," 9","400974442"
2,13.0166666666667,10.9833333333333,"LAC","Clippers offensive team rebound","8 "," 9","400974442"
2,13.0166666666667,10.9833333333333,"LAC","Patrick Beverley enters the game for Austin Rivers","8 "," 9","400974442"
2,13.0166666666667,10.9833333333333,"LAC","DeAndre Jordan enters the game for Willie Reed","8 "," 9","400974442"
2,13.0166666666667,10.9833333333333,"LAC","Danilo Gallinari makes free throw 2 of 2","8 "," 9","400974442"
2,13.4333333333333,10.5666666666667,"LAL","Jordan Clarkson makes 28-foot three point jumper (Kyle Kuzma assists)","8 "," 9","400974442"
2,13.6166666666667,10.3833333333333,"LAC","Lou Williams misses 14-foot jumper","8 "," 9","400974442"
2,13.65,10.35,"LAL","Corey Brewer defensive rebound","8 "," 9","400974442"
2,13.8,10.2,"LAL","Alex Caruso out of bounds bad pass turnover","8 "," 9","400974442"
2,13.8,10.2,"LAL","Julius Randle enters the game for Corey Brewer","8 "," 9","400974442"
2,14,10,"LAC","Danilo Gallinari misses 26-foot three point shot","8 "," 9","400974442"
2,14.0666666666667,9.93333333333333,"LAC","DeAndre Jordan offensive rebound","8 "," 9","400974442"
2,14.0833333333333,9.91666666666667,"LAC","DeAndre Jordan makes 3-foot hook shot","8 "," 9","400974442"
2,14.4,9.6,"LAL","Jordan Clarkson misses 22-foot jumper","8 "," 9","400974442"
2,14.4333333333333,9.56666666666667,"LAC","Lou Williams defensive rebound","8 "," 9","400974442"
2,14.55,9.45,"LAC","Lou Williams makes 5-foot two point shot (Patrick Beverley assists)","8 "," 9","400974442"
2,14.7333333333333,9.26666666666667,"LAL","Julius Randle makes layup","8 "," 9","400974442"
2,15,9,"LAC","Patrick Beverley makes 4-foot hook shot","8 "," 9","400974442"
2,15.0833333333333,8.91666666666667,"LAL","Patrick Beverley blocks Jordan Clarkson's alley oop layup","8 "," 9","400974442"
2,15.15,8.85,"LAC","DeAndre Jordan defensive rebound","8 "," 9","400974442"
2,15.2333333333333,8.76666666666667,"LAC","Wesley Johnson makes 20-foot pullup jump shot (DeAndre Jordan assists)","8 "," 9","400974442"
2,15.3333333333333,8.66666666666667,"LAL","Lakers Full timeout","8 "," 9","400974442"
2,15.3333333333333,8.66666666666667,"LAL","Brook Lopez enters the game for Alex Caruso","8 "," 9","400974442"
2,15.3333333333333,8.66666666666667,"LAL","Lonzo Ball enters the game for Andrew Bogut","8 "," 9","400974442"
2,15.4,8.6,"LAL","Julius Randle offensive charge","8 "," 9","400974442"
2,15.4,8.6,"LAL","Julius Randle offensive foul turnover","8 "," 9","400974442"
2,15.6666666666667,8.33333333333333,"LAC","Danilo Gallinari misses 16-foot step back jumpshot","8 "," 9","400974442"
2,15.7666666666667,8.23333333333333,"LAL","Julius Randle defensive rebound","8 "," 9","400974442"
2,15.9,8.1,"LAL","Julius Randle misses 26-foot three point jumper","8 "," 9","400974442"
2,15.9666666666667,8.03333333333333,"LAC","Wesley Johnson defensive rebound","8 "," 9","400974442"
2,16.1166666666667,7.88333333333333,"LAC","Lou Williams misses 8-foot two point shot","8 "," 9","400974442"
2,16.2,7.8,"LAC","DeAndre Jordan offensive rebound","8 "," 9","400974442"
2,16.2,7.8,"LAC","DeAndre Jordan makes tip shot","8 "," 9","400974442"
2,16.35,7.65,"LAL","Brook Lopez offensive foul","8 "," 9","400974442"
2,16.35,7.65,"LAL","Brook Lopez offensive foul turnover","8 "," 9","400974442"
2,16.6166666666667,7.38333333333333,"LAC","Danilo Gallinari misses jumper","8 "," 9","400974442"
2,16.6666666666667,7.33333333333333,"LAL","Julius Randle defensive rebound","8 "," 9","400974442"
2,16.75,7.25,"LAL","Kyle Kuzma makes 9-foot driving floating jump shot (Julius Randle assists)","8 "," 9","400974442"
2,17.0833333333333,6.91666666666667,"LAC","Patrick Beverley misses 26-foot three point jumper","8 "," 9","400974442"
2,17.1166666666667,6.88333333333333,"LAL","Kyle Kuzma defensive rebound","8 "," 9","400974442"
2,17.25,6.75,"LAL","Jordan Clarkson makes 18-foot pullup jump shot","8 "," 9","400974442"
2,17.4833333333333,6.51666666666667,"LAL","Brook Lopez defensive 3-seconds (technical foul)","8 "," 9","400974442"
2,17.4833333333333,6.51666666666667,"LAC","Lou Williams makes technical free throw","8 "," 9","400974442"
2,17.4833333333333,6.51666666666667,"LAL","Brandon Ingram enters the game for Jordan Clarkson","8 "," 9","400974442"
2,17.4833333333333,6.51666666666667,"LAC","Milos Teodosic enters the game for Lou Williams","8 "," 9","400974442"
2,17.4833333333333,6.51666666666667,"LAC","Blake Griffin enters the game for Wesley Johnson","8 "," 9","400974442"
2,17.6166666666667,6.38333333333333,"LAC","Blake Griffin misses 7-foot hook shot","8 "," 9","400974442"
2,17.65,6.35,"LAL","Lonzo Ball defensive rebound","8 "," 9","400974442"
2,17.75,6.25,"LAL","Kyle Kuzma misses 23-foot step back jumpshot","8 "," 9","400974442"
2,17.8,6.2,"LAC","Blake Griffin defensive rebound","8 "," 9","400974442"
2,17.85,6.15,"LAC","Milos Teodosic bad pass (Kyle Kuzma steals)","8 "," 9","400974442"
2,17.9333333333333,6.06666666666667,"LAL","Brandon Ingram misses layup","8 "," 9","400974442"
2,18,6,"LAC","DeAndre Jordan defensive rebound","8 "," 9","400974442"
2,18.05,5.95,"LAC","Patrick Beverley makes 26-foot three point jumper (Blake Griffin assists)","8 "," 9","400974442"
2,18.1166666666667,5.88333333333333,"LAL","Lakers Full timeout","8 "," 9","400974442"
2,18.1166666666667,5.88333333333333,"LAL","Larry Nance Jr. enters the game for Kyle Kuzma","8 "," 9","400974442"
2,18.1166666666667,5.88333333333333,"LAL","Corey Brewer enters the game for Julius Randle","8 "," 9","400974442"
2,18.35,5.65,"LAL","Brook Lopez misses 17-foot pullup jump shot","8 "," 9","400974442"
2,18.3833333333333,5.61666666666667,"LAC","Blake Griffin defensive rebound","8 "," 9","400974442"
2,18.6,5.4,"LAC","Danilo Gallinari misses 26-foot three point jumper","8 "," 9","400974442"
2,18.6666666666667,5.33333333333333,"LAL","Corey Brewer defensive rebound","8 "," 9","400974442"
2,18.7166666666667,5.28333333333333,"LAC","Patrick Beverley shooting foul","8 "," 9","400974442"
2,18.7166666666667,5.28333333333333,"LAL","Brandon Ingram misses free throw 1 of 2","8 "," 9","400974442"
2,18.7166666666667,5.28333333333333,"LAL","Lakers offensive team rebound","8 "," 9","400974442"
2,18.7166666666667,5.28333333333333,"LAL","Brandon Ingram makes free throw 2 of 2","8 "," 9","400974442"
2,18.9333333333333,5.06666666666667,"LAC","Danilo Gallinari misses 24-foot three point jumper","8 "," 9","400974442"
2,18.9666666666667,5.03333333333333,"LAL","Corey Brewer defensive rebound","8 "," 9","400974442"
2,19.1833333333333,4.81666666666667,"LAL","Lonzo Ball makes 27-foot three point jumper (Brook Lopez assists)","8 "," 9","400974442"
2,19.5333333333333,4.46666666666667,"LAC","Patrick Beverley misses layup","8 "," 9","400974442"
2,19.65,4.35,"LAC","DeAndre Jordan offensive rebound","8 "," 9","400974442"
2,19.65,4.35,"LAC","DeAndre Jordan makes dunk","8 "," 9","400974442"
2,19.6833333333333,4.31666666666667,"LAL","Lonzo Ball lost ball turnover (Patrick Beverley steals)","8 "," 9","400974442"
2,19.7666666666667,4.23333333333333,"LAC","makes 1-foot shot","8 "," 9","400974442"
2,20,4,"LAL","Larry Nance Jr. lost ball turnover (Patrick Beverley steals)","8 "," 9","400974442"
2,20.1666666666667,3.83333333333333,"LAC","Blake Griffin makes driving layup","8 "," 9","400974442"
2,20.3833333333333,3.61666666666667,"LAL","Brandon Ingram makes 17-foot two point shot","8 "," 9","400974442"
2,20.6333333333333,3.36666666666667,"LAC","Blake Griffin makes 26-foot three point jumper (Milos Teodosic assists)","8 "," 9","400974442"
2,20.85,3.15,"LAL","Lakers Full timeout","8 "," 9","400974442"
2,20.85,3.15,"LAC","Austin Rivers enters the game for Patrick Beverley","8 "," 9","400974442"
2,20.9166666666667,3.08333333333333,"LAC","Danilo Gallinari personal foul","8 "," 9","400974442"
2,21.05,2.95,"LAL","Brandon Ingram misses 18-foot pullup jump shot","8 "," 9","400974442"
2,21.0833333333333,2.91666666666667,"LAC","Blake Griffin defensive rebound","8 "," 9","400974442"
2,21.1833333333333,2.81666666666667,"LAL","Brandon Ingram personal foul","8 "," 9","400974442"
