"Quarter","Time","Quarter_Time","Team","Play","Home_Points","Away_Points","Game_Id"
3,34.4166666666667,1.58333333333333,"GS","Klay Thompson misses 10-foot two point shot","9 "," 97","400974438"
3,34.5,1.5,"HOU","Chris Paul defensive rebound","9 "," 97","400974438"
3,34.5833333333333,1.41666666666667,"HOU","Trevor Ariza misses 27-foot three point jumper","9 "," 97","400974438"
3,34.6833333333334,1.31666666666667,"GS","Patrick McCaw defensive rebound","9 "," 97","400974438"
3,34.9666666666667,1.03333333333333,"GS","Patrick McCaw misses driving layup","9 "," 97","400974438"
3,35.05,0.95,"HOU","PJ Tucker defensive rebound","9 "," 97","400974438"
3,35.05,0.95,"HOU","Eric Gordon steps out of bounds turnover","9 "," 97","400974438"
3,35.1166666666667,0.883333333333333,"GS","Jordan Bell makes dunk (Draymond Green assists)","9 "," 99","400974438"
3,35.25,0.75,"HOU","Eric Gordon makes two point shot","9 "," 99","400974438"
3,35.25,0.75,"GS","Patrick McCaw shooting foul","9 "," 99","400974438"
3,35.25,0.75,"HOU","Eric Gordon misses free throw 1 of 1","9 "," 99","400974438"
3,35.3166666666667,0.683333333333333,"GS","Draymond Green defensive rebound","9 "," 99","400974438"
3,35.3666666666667,0.633333333333333,"GS","Draymond Green misses layup","9 "," 99","400974438"
3,35.4666666666667,0.533333333333333,"GS","Draymond Green offensive rebound","9 "," 99","400974438"
3,35.4666666666667,0.533333333333333,"GS","Nick Young bad pass (Eric Gordon steals)","9 "," 99","400974438"
3,35.4666666666667,0.533333333333333,"HOU","Eric Gordon makes driving layup","9 "," 99","400974438"
3,35.4666666666667,0.533333333333333,"GS","Jordan Bell shooting foul","9 "," 99","400974438"
3,35.4666666666667,0.533333333333333,"HOU","Eric Gordon misses free throw 1 of 1","9 "," 99","400974438"
3,35.4666666666667,0.533333333333333,"GS","Stephen Curry enters the game for Patrick McCaw","9 "," 99","400974438"
3,35.4666666666667,0.533333333333333,"GS","Kevin Durant enters the game for Jordan Bell","9 "," 99","400974438"
3,35.6,0.4,"HOU","Trevor Ariza offensive rebound","9 "," 99","400974438"
3,35.6,0.4,"HOU","Trevor Ariza misses tip shot","9 "," 99","400974438"
3,35.65,0.35,"GS","Draymond Green defensive rebound","9 "," 99","400974438"
3,35.8,0.2,"HOU","Trevor Ariza shooting foul","9 "," 99","400974438"
3,35.8,0.2,"GS","Draymond Green makes free throw 1 of 2","9 "," 99","400974438"
3,35.8,0.2,"GS","Patrick McCaw enters the game for Klay Thompson","9 "," 99","400974438"
3,35.8,0.2,"GS","Draymond Green makes free throw 2 of 2","9 "," 99","400974438"
3,35.8,0.2,"GS","Shaun Livingston enters the game for Stephen Curry","9 "," 99","400974438"
3,35.8,0.2,"GS","Jordan Bell enters the game for Kevin Durant","9 "," 99","400974438"
3,35.9833333333333,0.0166666666666667,"HOU","Chris Paul misses 28-foot three point jumper","9 "," 99","400974438"
3,35.9833333333333,0.0166666666666667,"HOU","Rockets offensive team rebound","9 "," 99","400974438"
3,36,0,"GS","End of the 3rd Quarter","9 "," 99","400974438"
4,36,12,"GS","Kevin Durant enters the game for Draymond Green","9 "," 99","400974438"
4,36,12,"GS","David West enters the game for Jordan Bell","9 "," 99","400974438"
4,36,12,"GS","Stephen Curry enters the game for Patrick McCaw","9 "," 99","400974438"
4,36,12,"HOU","Ryan Anderson enters the game for PJ Tucker","9 "," 99","400974438"
4,36.3,11.7,"HOU","Chris Paul makes 14-foot step back jumpshot","90 "," 99","400974438"
4,36.6833333333333,11.3166666666667,"GS","David West lost ball turnover (Chris Paul steals)","90 "," 99","400974438"
4,36.8333333333333,11.1666666666667,"HOU","Luc Mbah a Moute makes 25-foot three pointer (Chris Paul assists)","93 "," 99","400974438"
4,37.0833333333333,10.9166666666667,"GS","Stephen Curry misses layup","93 "," 99","400974438"
4,37.15,10.85,"HOU","Trevor Ariza defensive rebound","93 "," 99","400974438"
4,37.2333333333333,10.7666666666667,"HOU","Eric Gordon makes 11-foot two point shot (Trevor Ariza assists)","95 "," 99","400974438"
4,37.2333333333333,10.7666666666667,"GS","Warriors Full timeout","95 "," 99","400974438"
4,37.4166666666667,10.5833333333333,"GS","Stephen Curry out of bounds bad pass turnover","95 "," 99","400974438"
4,37.65,10.35,"HOU","Luc Mbah a Moute makes driving layup (Chris Paul assists)","97 "," 99","400974438"
4,37.8166666666667,10.1833333333333,"GS","Nick Young makes 26-foot three point jumper (Stephen Curry assists)","97 "," 99","400974438"
4,38.1666666666667,9.83333333333333,"HOU","Luc Mbah a Moute makes driving layup (Chris Paul assists)","99 "," 99","400974438"
4,38.35,9.65,"GS","Stephen Curry misses step back jumpshot","99 "," 99","400974438"
4,38.45,9.55,"HOU","Chris Paul defensive rebound","99 "," 99","400974438"
4,38.5,9.5,"GS","Nick Young personal foul","99 "," 99","400974438"
4,38.6166666666667,9.38333333333333,"HOU","Chris Paul misses 28-foot three point jumper","99 "," 99","400974438"
4,38.6666666666667,9.33333333333333,"GS","Stephen Curry defensive rebound","99 "," 99","400974438"
4,38.9333333333333,9.06666666666667,"GS","Shaun Livingston misses 9-foot jumper","99 "," 99","400974438"
4,39.0333333333333,8.96666666666667,"HOU","Ryan Anderson defensive rebound","99 "," 99","400974438"
4,39.0666666666667,8.93333333333333,"HOU","Eric Gordon makes driving layup (Chris Paul assists)","99 "," 99","400974438"
4,39.35,8.65,"GS","Kevin Durant misses jumper","99 "," 99","400974438"
4,39.4166666666667,8.58333333333333,"GS","David West offensive rebound","99 "," 99","400974438"
4,39.6,8.4,"GS","David West makes hook shot (Shaun Livingston assists)","99 "," 99","400974438"
4,39.8833333333333,8.11666666666667,"HOU","Eric Gordon misses 27-foot three point pullup jump shot","99 "," 99","400974438"
4,39.9166666666667,8.08333333333333,"HOU","Rockets offensive team rebound","99 "," 99","400974438"
4,39.9166666666667,8.08333333333333,"GS","Kevon Looney enters the game for David West","99 "," 99","400974438"
4,39.9166666666667,8.08333333333333,"HOU","James Harden enters the game for Trevor Ariza","99 "," 99","400974438"
4,39.9166666666667,8.08333333333333,"HOU","PJ Tucker enters the game for Eric Gordon","99 "," 99","400974438"
4,39.9333333333333,8.06666666666667,"GS","Kevin Durant personal foul","99 "," 99","400974438"
4,39.9333333333333,8.06666666666667,"GS","Klay Thompson enters the game for Shaun Livingston","99 "," 99","400974438"
4,40.3333333333333,7.66666666666667,"HOU","Kevin Durant blocks Ryan Anderson 's 20-foot jumper","99 "," 99","400974438"
4,40.4166666666667,7.58333333333333,"GS","Kevon Looney defensive rebound","99 "," 99","400974438"
4,40.45,7.55,"GS","Stephen Curry misses 27-foot three point jumper","99 "," 99","400974438"
4,40.5333333333333,7.46666666666667,"HOU","Chris Paul defensive rebound","99 "," 99","400974438"
4,40.7666666666667,7.23333333333333,"HOU","Chris Paul misses 15-foot jumper","99 "," 99","400974438"
4,40.8333333333333,7.16666666666667,"GS","Kevon Looney defensive rebound","99 "," 99","400974438"
4,41,7,"GS","Stephen Curry misses two point shot","99 "," 99","400974438"
4,41.1166666666667,6.88333333333333,"HOU","Luc Mbah a Moute defensive rebound","99 "," 99","400974438"
4,41.15,6.85,"HOU","Klay Thompson blocks Luc Mbah a Moute's layup","99 "," 99","400974438"
4,41.2333333333333,6.76666666666667,"GS","Kevin Durant defensive rebound","99 "," 99","400974438"
4,41.2333333333333,6.76666666666667,"GS","Klay Thompson makes 26-foot three point jumper (Stephen Curry assists)","99 "," 99","400974438"
4,41.2333333333333,6.76666666666667,"HOU","Rockets Full timeout","99 "," 99","400974438"
4,41.2333333333333,6.76666666666667,"HOU","Clint Capela enters the game for Luc Mbah a Moute","99 "," 99","400974438"
4,41.55,6.45,"HOU","James Harden misses layup","99 "," 99","400974438"
4,41.6333333333333,6.36666666666667,"HOU","Clint Capela offensive rebound","99 "," 99","400974438"
4,41.65,6.35,"HOU","Clint Capela makes 1-foot dunk","99 "," 99","400974438"
4,41.8166666666667,6.18333333333333,"GS","Kevin Durant lost ball turnover (Chris Paul steals)","99 "," 99","400974438"
4,41.9,6.1,"HOU","Clint Capela makes layup (Chris Paul assists)","99 "," 99","400974438"
4,42.2,5.8,"GS","Stephen Curry makes 12-foot two point shot","99 "," 99","400974438"
4,42.6166666666667,5.38333333333333,"HOU","James Harden makes 19-foot two point shot","99 "," 99","400974438"
4,42.8,5.2,"GS","Stephen Curry makes 26-foot step back jumpshot","99 "," 99","400974438"
4,43.05,4.95,"HOU","Chris Paul bad pass (Kevon Looney steals)","99 "," 99","400974438"
4,43.1333333333333,4.86666666666667,"GS","Klay Thompson misses 26-foot three point jumper","99 "," 99","400974438"
4,43.2,4.8,"HOU","PJ Tucker defensive rebound","99 "," 99","400974438"
4,43.2166666666667,4.78333333333333,"HOU","Clint Capela makes 3-foot dunk (James Harden assists)","99 "," 99","400974438"
4,43.2166666666667,4.78333333333333,"GS","Nick Young shooting foul","99 "," 99","400974438"
4,43.2166666666667,4.78333333333333,"GS","Shaun Livingston enters the game for Kevin Durant","99 "," 99","400974438"
4,43.2166666666667,4.78333333333333,"HOU","Eric Gordon enters the game for Chris Paul","99 "," 99","400974438"
4,43.2166666666667,4.78333333333333,"HOU","Clint Capela misses free throw 1 of 1","99 "," 99","400974438"
4,43.2833333333333,4.71666666666667,"HOU","Ryan Anderson offensive rebound","99 "," 99","400974438"
4,43.6,4.4,"HOU","James Harden misses 8-foot jumper","99 "," 99","400974438"
4,43.6666666666667,4.33333333333333,"GS","Nick Young defensive rebound","99 "," 99","400974438"
4,43.7666666666667,4.23333333333333,"GS","Stephen Curry makes driving layup (Klay Thompson assists)","99 "," 99","400974438"
4,43.9833333333333,4.01666666666667,"HOU","Eric Gordon makes 2-foot two point shot (James Harden assists)","99 "," 99","400974438"
4,43.9833333333333,4.01666666666667,"GS","Kevon Looney shooting foul","99 "," 99","400974438"
4,43.9833333333333,4.01666666666667,"HOU","Trevor Ariza enters the game for Clint Capela","99 "," 99","400974438"
4,43.9833333333333,4.01666666666667,"HOU","Eric Gordon makes free throw 1 of 1","99 "," 99","400974438"
4,44.1666666666667,3.83333333333333,"GS","Stephen Curry makes driving layup","99 "," 99","400974438"
4,44.4833333333333,3.51666666666667,"HOU","PJ Tucker makes 23-foot three point jumper (James Harden assists)","99 "," 99","400974438"
4,44.8833333333333,3.11666666666667,"GS","Stephen Curry misses 26-foot three point jumper","99 "," 99","400974438"
4,44.9333333333333,3.06666666666667,"HOU","PJ Tucker defensive rebound","99 "," 99","400974438"
4,45.2833333333333,2.71666666666667,"HOU","PJ Tucker misses 23-foot three point jumper","99 "," 99","400974438"
4,45.3333333333333,2.66666666666667,"GS","Klay Thompson defensive rebound","99 "," 99","400974438"
4,45.4666666666667,2.53333333333333,"HOU","Ryan Anderson shooting foul","99 "," 99","400974438"
4,45.4666666666667,2.53333333333333,"GS","Kevon Looney makes free throw 1 of 2","99 "," 99","400974438"
4,45.4666666666667,2.53333333333333,"GS","Kevin Durant enters the game for Nick Young","99 "," 99","400974438"
4,45.4666666666667,2.53333333333333,"GS","Kevon Looney misses free throw 2 of 2","99 "," 99","400974438"
4,45.5,2.5,"HOU","PJ Tucker defensive rebound","99 "," 99","400974438"
4,45.85,2.15,"HOU","Trevor Ariza makes 26-foot three point jumper (Ryan Anderson assists)","99 "," 99","400974438"
4,46.0166666666667,1.98333333333333,"GS","Warriors Full timeout","99 "," 99","400974438"
4,46.0166666666667,1.98333333333333,"GS","Patrick McCaw enters the game for Kevon Looney","99 "," 99","400974438"
4,46.0166666666667,1.98333333333333,"HOU","Luc Mbah a Moute enters the game for Ryan Anderson","99 "," 99","400974438"
4,46.2833333333333,1.71666666666667,"GS","Patrick McCaw makes 20-foot jumper (Kevin Durant assists)","99 "," 99","400974438"
4,46.4666666666667,1.53333333333333,"HOU","James Harden makes driving layup","99 "," 99","400974438"
4,46.8166666666667,1.18333333333333,"GS","Eric Gordon blocks Kevin Durant 's 9-foot jumper","99 "," 99","400974438"
4,46.8166666666667,1.18333333333333,"HOU","Luc Mbah a Moute defensive rebound","99 "," 99","400974438"
4,47.1333333333333,0.866666666666667,"HOU","James Harden misses jumper","99 "," 99","400974438"
4,47.2166666666667,0.783333333333333,"HOU","Luc Mbah a Moute offensive rebound","99 "," 99","400974438"
4,47.2333333333333,0.766666666666667,"HOU","Eric Gordon misses 29-foot three point jumper","99 "," 99","400974438"
4,47.2666666666667,0.733333333333333,"HOU","Rockets offensive team rebound","99 "," 99","400974438"
4,47.2666666666667,0.733333333333333,"GS","Shaun Livingston shooting foul","99 "," 99","400974438"
4,47.2666666666667,0.733333333333333,"HOU","PJ Tucker makes free throw 1 of 2","99 "," 99","400974438"
4,47.2666666666667,0.733333333333333,"HOU","PJ Tucker makes free throw 2 of 2","99 "," 99","400974438"
4,47.4666666666667,0.533333333333333,"GS","Stephen Curry bad pass (Trevor Ariza steals)","99 "," 99","400974438"
4,47.8166666666667,0.183333333333333,"HOU","James Harden misses 27-foot three point jumper","99 "," 99","400974438"
4,47.8333333333333,0.166666666666667,"GS","Warriors defensive team rebound","99 "," 99","400974438"
4,47.8333333333333,0.166666666666667,"HOU","PJ Tucker loose ball foul","99 "," 99","400974438"
4,47.8333333333333,0.166666666666667,"GS","Warriors Full timeout","99 "," 99","400974438"
4,47.9166666666667,0.0833333333333333,"GS","Stephen Curry misses 26-foot three point jumper","99 "," 99","400974438"
4,48,0,"GS","Shaun Livingston offensive rebound","99 "," 99","400974438"
4,48,0,"GS","End of the 4th Quarter","99 "," 99","400974438"
4,48,0,"GS","End of Game","99 "," 99","400974438"
1,0,12,"WSH","Joel Embiid vs. Marcin Gortat (Jason Smith gains possession)","0 "," 0","400974439"
1,0.266666666666667,11.7333333333333,"WSH","Bradley Beal misses 13-foot two point shot","0 "," 0","400974439"
1,0.35,11.65,"PHI","Ben Simmons defensive rebound","0 "," 0","400974439"
1,0.366666666666667,11.6333333333333,"PHI","JJ Redick steps out of bounds turnover","0 "," 0","400974439"
1,0.5,11.5,"WSH","Otto Porter Jr. makes 17-foot pullup jump shot (John Wall assists)","0 "," 2","400974439"
1,0.716666666666667,11.2833333333333,"WSH","Jason Smith shooting foul","0 "," 2","400974439"
1,0.716666666666667,11.2833333333333,"PHI","Joel Embiid makes free throw 1 of 2","1 "," 2","400974439"
1,0.716666666666667,11.2833333333333,"PHI","Joel Embiid makes free throw 2 of 2","2 "," 2","400974439"
1,0.866666666666667,11.1333333333333,"WSH","Otto Porter Jr. makes 16-foot two point shot (John Wall assists)","2 "," 4","400974439"
1,1.15,10.85,"PHI","Robert Covington misses 27-foot three point pullup jump shot","2 "," 4","400974439"
1,1.21666666666667,10.7833333333333,"WSH","Marcin Gortat defensive rebound","2 "," 4","400974439"
1,1.36666666666667,10.6333333333333,"WSH","Robert Covington blocks John Wall 's 14-foot two point shot","2 "," 4","400974439"
1,1.45,10.55,"PHI","Joel Embiid defensive rebound","2 "," 4","400974439"
1,1.48333333333333,10.5166666666667,"PHI","Robert Covington makes 25-foot three point jumper (Joel Embiid assists)","5 "," 4","400974439"
1,1.8,10.2,"WSH","Otto Porter Jr. misses jumper","5 "," 4","400974439"
1,1.86666666666667,10.1333333333333,"WSH","Bradley Beal offensive rebound","5 "," 4","400974439"
1,1.88333333333333,10.1166666666667,"WSH","Bradley Beal misses 16-foot jumper","5 "," 4","400974439"
1,1.88333333333333,10.1166666666667,"WSH","Otto Porter Jr. offensive rebound","5 "," 4","400974439"
1,1.91666666666667,10.0833333333333,"PHI","Robert Covington personal foul","5 "," 4","400974439"
1,2.11666666666667,9.88333333333333,"WSH","Otto Porter Jr. makes 12-foot running pullup jump shot","5 "," 6","400974439"
1,2.26666666666667,9.73333333333333,"PHI","Otto Porter Jr. blocks Ben Simmons 's 3-foot layup","5 "," 6","400974439"
1,2.26666666666667,9.73333333333333,"WSH","Marcin Gortat defensive rebound","5 "," 6","400974439"
1,2.4,9.6,"WSH","Otto Porter Jr. makes layup (John Wall assists)","5 "," 8","400974439"
1,2.61666666666667,9.38333333333333,"PHI","Jerryd Bayless misses 26-foot three point jumper","5 "," 8","400974439"
1,2.65,9.35,"WSH","Marcin Gortat defensive rebound","5 "," 8","400974439"
1,2.71666666666667,9.28333333333333,"WSH","John Wall misses 25-foot three point jumper","5 "," 8","400974439"
1,2.78333333333333,9.21666666666667,"PHI","Joel Embiid defensive rebound","5 "," 8","400974439"
1,2.85,9.15,"WSH","Otto Porter Jr. personal foul","5 "," 8","400974439"
1,3.06666666666667,8.93333333333333,"PHI","Joel Embiid makes 15-foot pullup jump shot","7 "," 8","400974439"
1,3.28333333333333,8.71666666666667,"WSH","Bradley Beal makes driving dunk (John Wall assists)","7 "," 8","400974439"
1,3.53333333333333,8.46666666666667,"PHI","Ben Simmons makes two point shot (Jerryd Bayless assists)","9 "," 8","400974439"
1,3.75,8.25,"WSH","Ben Simmons blocks Jason Smith 's 26-foot three point pullup jump shot","9 "," 8","400974439"
1,3.85,8.15,"WSH","Jason Smith offensive rebound","9 "," 8","400974439"
1,3.88333333333333,8.11666666666667,"WSH","John Wall misses jumper","9 "," 8","400974439"
1,3.93333333333333,8.06666666666667,"PHI","Joel Embiid defensive rebound","9 "," 8","400974439"
1,4.01666666666667,7.98333333333333,"PHI","Jerryd Bayless misses 26-foot three point pullup jump shot","9 "," 8","400974439"
1,4.05,7.95,"WSH","Marcin Gortat defensive rebound","9 "," 8","400974439"
1,4.23333333333333,7.76666666666667,"WSH","John Wall makes driving layup","9 "," 8","400974439"
1,4.55,7.45,"PHI","Jerryd Bayless makes 23-foot three point jumper (Ben Simmons assists)","9 "," 8","400974439"
1,4.81666666666667,7.18333333333333,"WSH","Marcin Gortat makes jumper (Bradley Beal assists)","9 "," 8","400974439"
1,5.01666666666667,6.98333333333333,"PHI","Robert Covington misses 29-foot three point jumper","9 "," 8","400974439"
1,5.08333333333333,6.91666666666667,"WSH","John Wall defensive rebound","9 "," 8","400974439"
1,5.23333333333333,6.76666666666667,"WSH","Marcin Gortat misses 9-foot hook shot","9 "," 8","400974439"
1,5.26666666666667,6.73333333333333,"WSH","Marcin Gortat offensive rebound","9 "," 8","400974439"
1,5.28333333333333,6.71666666666667,"WSH","Wizards Full timeout","9 "," 8","400974439"
1,5.28333333333333,6.71666666666667,"PHI","Amir Johnson enters the game for Jerryd Bayless","9 "," 8","400974439"
1,5.28333333333333,6.71666666666667,"PHI","Markelle Fultz enters the game for Joel Embiid","9 "," 8","400974439"
1,5.48333333333333,6.51666666666667,"WSH","John Wall makes 14-foot pullup jump shot","9 "," 8","400974439"
1,5.73333333333333,6.26666666666667,"PHI","Marcin Gortat blocks JJ Redick 's 10-foot two point shot","9 "," 8","400974439"
1,5.78333333333333,6.21666666666667,"WSH","Otto Porter Jr. defensive rebound","9 "," 8","400974439"
1,5.85,6.15,"WSH","John Wall misses 26-foot three point jumper","9 "," 8","400974439"
1,5.91666666666667,6.08333333333333,"PHI","JJ Redick defensive rebound","9 "," 8","400974439"
1,6.1,5.9,"PHI","Ben Simmons makes 9-foot two point shot","9 "," 8","400974439"
1,6.4,5.6,"WSH","Bradley Beal misses 17-foot pullup jump shot","9 "," 8","400974439"
1,6.45,5.55,"PHI","Robert Covington defensive rebound","9 "," 8","400974439"
1,6.63333333333333,5.36666666666667,"PHI","Markelle Fultz misses layup","9 "," 8","400974439"
1,6.66666666666667,5.33333333333333,"WSH","Marcin Gortat defensive rebound","9 "," 8","400974439"
1,6.88333333333333,5.11666666666667,"WSH","Marcin Gortat makes 9-foot driving floating jump shot (Bradley Beal assists)","9 "," 8","400974439"
1,7.06666666666667,4.93333333333333,"WSH","Marcin Gortat personal foul","9 "," 8","400974439"
1,7.06666666666667,4.93333333333333,"WSH","Kelly Oubre Jr. enters the game for Jason Smith","9 "," 8","400974439"
1,7.06666666666667,4.93333333333333,"PHI","Dario Saric enters the game for Ben Simmons","9 "," 8","400974439"
1,7.06666666666667,4.93333333333333,"PHI","T.J. McConnell enters the game for Robert Covington","9 "," 8","400974439"
1,7.26666666666667,4.73333333333333,"WSH","John Wall shooting foul","9 "," 8","400974439"
1,7.26666666666667,4.73333333333333,"PHI","Markelle Fultz misses free throw 1 of 2","9 "," 8","400974439"
1,7.26666666666667,4.73333333333333,"PHI","76ers offensive team rebound","9 "," 8","400974439"
1,7.26666666666667,4.73333333333333,"WSH","Mike Scott enters the game for Otto Porter Jr.","9 "," 8","400974439"
1,7.26666666666667,4.73333333333333,"PHI","Timothe Luwawu-Cabarrot enters the game for JJ Redick","9 "," 8","400974439"
1,7.26666666666667,4.73333333333333,"PHI","Markelle Fultz misses free throw 2 of 2","9 "," 8","400974439"
1,7.33333333333333,4.66666666666667,"WSH","Marcin Gortat defensive rebound","9 "," 8","400974439"
1,7.61666666666667,4.38333333333333,"WSH","Kelly Oubre Jr. makes 26-foot three pointer","9 "," 8","400974439"
1,7.85,4.15,"PHI","Bradley Beal blocks Markelle Fultz 's 7-foot layup","9 "," 8","400974439"
1,7.95,4.05,"PHI","Markelle Fultz offensive rebound","9 "," 8","400974439"
1,7.96666666666667,4.03333333333333,"PHI","Markelle Fultz makes layup","9 "," 8","400974439"
1,8.2,3.8,"WSH","Mike Scott makes layup (Kelly Oubre Jr. assists)","9 "," 8","400974439"
1,8.43333333333333,3.56666666666667,"PHI","Dario Saric misses 3-foot two point shot","9 "," 8","400974439"
1,8.48333333333333,3.51666666666667,"WSH","Marcin Gortat defensive rebound","9 "," 8","400974439"
1,8.53333333333333,3.46666666666667,"WSH","John Wall misses layup","9 "," 8","400974439"
1,8.53333333333333,3.46666666666667,"PHI","Timothe Luwawu-Cabarrot defensive rebound","9 "," 8","400974439"
1,8.65,3.35,"PHI","Amir Johnson misses driving layup","9 "," 8","400974439"
1,8.73333333333334,3.26666666666667,"PHI","Markelle Fultz offensive rebound","9 "," 8","400974439"
1,8.73333333333334,3.26666666666667,"PHI","Markelle Fultz makes two point shot","9 "," 8","400974439"
1,8.78333333333333,3.21666666666667,"PHI","Amir Johnson personal foul","9 "," 8","400974439"
1,8.78333333333333,3.21666666666667,"WSH","Jodie Meeks enters the game for Bradley Beal","9 "," 8","400974439"
1,8.96666666666667,3.03333333333333,"WSH","Jodie Meeks misses 25-foot three point jumper","9 "," 8","400974439"
1,9.03333333333333,2.96666666666667,"PHI","Amir Johnson defensive rebound","9 "," 8","400974439"
1,9.18333333333334,2.81666666666667,"PHI","Dario Saric misses 27-foot three point jumper","9 "," 8","400974439"
1,9.25,2.75,"WSH","Marcin Gortat defensive rebound","9 "," 8","400974439"
1,9.45,2.55,"WSH","John Wall makes driving dunk","9 "," 8","400974439"
1,9.46666666666667,2.53333333333333,"PHI","76ers Full timeout","9 "," 8","400974439"
1,9.46666666666667,2.53333333333333,"WSH","Ian Mahinmi enters the game for John Wall","9 "," 8","400974439"
1,9.46666666666667,2.53333333333333,"WSH","Tim Frazier enters the game for Marcin Gortat","9 "," 8","400974439"
1,9.46666666666667,2.53333333333333,"PHI","Joel Embiid enters the game for Amir Johnson","9 "," 8","400974439"
1,9.73333333333333,2.26666666666667,"PHI","Ian Mahinmi blocks Timothe Luwawu-Cabarrot 's 2-foot driving layup","9 "," 8","400974439"
1,9.81666666666667,2.18333333333333,"WSH","Kelly Oubre Jr. defensive rebound","9 "," 8","400974439"
1,9.98333333333333,2.01666666666667,"WSH","Ian Mahinmi offensive charge","9 "," 8","400974439"
1,9.98333333333333,2.01666666666667,"WSH","Ian Mahinmi offensive foul turnover","9 "," 8","400974439"
1,10.2333333333333,1.76666666666667,"PHI","T.J. McConnell lost ball turnover (Kelly Oubre Jr. steals)","9 "," 8","400974439"
1,10.2666666666667,1.73333333333333,"WSH","Markelle Fultz blocks Kelly Oubre Jr. 's 1-foot layup","9 "," 8","400974439"
1,10.2666666666667,1.73333333333333,"WSH","Wizards offensive team rebound","9 "," 8","400974439"
1,10.35,1.65,"WSH","Jodie Meeks misses 11-foot jumper","9 "," 8","400974439"
1,10.3833333333333,1.61666666666667,"PHI","Joel Embiid defensive rebound","9 "," 8","400974439"
1,10.4166666666667,1.58333333333333,"PHI","Dario Saric makes layup (Timothe Luwawu-Cabarrot assists)","9 "," 8","400974439"
1,10.4166666666667,1.58333333333333,"WSH","Tim Frazier shooting foul","9 "," 8","400974439"
1,10.4166666666667,1.58333333333333,"PHI","Dario Saric makes free throw 1 of 1","9 "," 8","400974439"
1,10.7666666666667,1.23333333333333,"WSH","Tim Frazier misses 17-foot jumper","9 "," 8","400974439"
1,10.8166666666667,1.18333333333333,"PHI","Joel Embiid defensive rebound","9 "," 8","400974439"
1,10.9333333333333,1.06666666666667,"PHI","Timothe Luwawu-Cabarrot misses three point jumper","9 "," 8","400974439"
1,10.9666666666667,1.03333333333333,"WSH","Ian Mahinmi defensive rebound","9 "," 8","400974439"
1,11.0666666666667,0.933333333333333,"WSH","Mike Scott makes 25-foot three point jumper (Tim Frazier assists)","9 "," 8","400974439"
1,11.2333333333333,0.766666666666667,"PHI","Joel Embiid misses 27-foot three point jumper","9 "," 8","400974439"
1,11.3,0.7,"WSH","Mike Scott defensive rebound","9 "," 8","400974439"
1,11.4,0.6,"PHI","Dario Saric shooting foul","9 "," 8","400974439"
1,11.4,0.6,"WSH","Jodie Meeks makes free throw 1 of 2","9 "," 8","400974439"
1,11.4,0.6,"WSH","Jodie Meeks makes free throw 2 of 2","9 "," 8","400974439"
1,11.6166666666667,0.383333333333333,"WSH","Ian Mahinmi shooting foul","9 "," 8","400974439"
1,11.6166666666667,0.383333333333333,"PHI","Joel Embiid makes free throw 1 of 2","9 "," 8","400974439"
1,11.6166666666667,0.383333333333333,"PHI","Joel Embiid makes free throw 2 of 2","9 "," 8","400974439"
1,11.9833333333333,0.0166666666666667,"WSH","Ian Mahinmi makes alley oop layup (Tim Frazier assists)","9 "," 8","400974439"
1,12,0,"WSH","End of the 1st Quarter","9 "," 8","400974439"
2,12,12,"PHI","Ben Simmons enters the game for Timothe Luwawu-Cabarrot","9 "," 8","400974439"
2,12,12,"PHI","Robert Covington enters the game for Dario Saric","9 "," 8","400974439"
2,12,12,"PHI","Jerryd Bayless enters the game for T.J. McConnell","9 "," 8","400974439"
2,12,12,"PHI","JJ Redick enters the game for Markelle Fultz","9 "," 8","400974439"
